{
  "candidate_id": "demo_candidate",
  "skill_registry_version": "0.4",
  "assessments": [
    {
      "candidate_id": "demo_candidate",
      "team_skill_id": "T-AI-01",
      "team_skill_name": "机器学习与深度学习",
      "status": "supported",
      "inference_mode": "direct_behavior",
      "evidence": [
        {
          "text": "独立训练并优化深度学习模型，完成部署验证。",
          "source_experience_id": "demo_project",
          "start": 0,
          "end": 22,
          "fact": "",
          "behavior": "",
          "context": "",
          "result": ""
        }
      ],
      "reason": "synthetic integration fixture",
      "confidence": 0.95,
      "atomic_abilities": [
        "训练并优化深度学习模型"
      ],
      "audit_flags": []
    }
  ],
  "metadata": {
    "schema_version": "candidate_skill_profile_v4_3_4"
  }
}